{"capability":"mavi-vehicle-subclass-v1","datasetId":"visdrone2019-mot","mappings":[{"evaluation":"excluded","kind":"unsupported","maviClass":null,"nativeClass":"awning-tricycle","reason":"A three-wheeled vehicle; mavi-vehicle-subclass-v1 has no tricycle class and none of its four classes fits.","unsupportedKind":"vehicle-unresolved"},{"evaluation":"excluded","kind":"unsupported","maviClass":null,"nativeClass":"bicycle","reason":"Not one of the four MAVI motor-vehicle classes (harness plan section 12).","unsupportedKind":"outside-capability"},{"evaluation":"scored","kind":"exact","maviClass":"bus","nativeClass":"bus","reason":"Same practical meaning: buses and coaches. Caveat: the release gives no written definition."},{"evaluation":"scored","kind":"exact","maviClass":"car","nativeClass":"car","reason":"Same practical meaning: passenger cars; vans are a separate native class. Caveat: the release gives no written definition (SUV and pickup placement unstated)."},{"evaluation":"scored","kind":"exact","maviClass":"motorcycle","nativeClass":"motor","reason":"Same practical meaning: motorised two-wheelers. Caveat: scooter and moped placement is not stated in the toolkit README."},{"evaluation":"excluded","kind":"unsupported","maviClass":null,"nativeClass":"others","reason":"An object of no listed category, not evaluated by the VisDrone toolkits: the adapter ignores it on every frame, so it never enters a population (the mapping row only completes the taxonomy).","unsupportedKind":"vehicle-unresolved"},{"evaluation":"excluded","kind":"unsupported","maviClass":null,"nativeClass":"pedestrian","reason":"A person, not a Vehicle.","unsupportedKind":"outside-capability"},{"evaluation":"excluded","kind":"unsupported","maviClass":null,"nativeClass":"people","reason":"A person, not a Vehicle.","unsupportedKind":"outside-capability"},{"evaluation":"excluded","kind":"unsupported","maviClass":null,"nativeClass":"tricycle","reason":"A three-wheeled vehicle; mavi-vehicle-subclass-v1 has no tricycle class and none of its four classes fits.","unsupportedKind":"vehicle-unresolved"},{"evaluation":"scored","kind":"exact","maviClass":"truck","nativeClass":"truck","reason":"Same practical meaning: goods vehicles. Caveat: pickup placement is not stated in the toolkit README."},{"evaluation":"excluded","kind":"unsupported","maviClass":null,"nativeClass":"van","reason":"v1 splits vans by body into car or truck and the native label does not (taxonomy review).","unsupportedKind":"vehicle-unresolved"}],"release":"VisDrone2019-MOT (val, test-dev; toolkit v1.0.2 category scheme)","schemaVersion":"benchmark-class-mapping-v1"}