{"capability":"mavi-vehicle-subclass-v1","datasetId":"bdd100k-mot-2020","mappings":[{"evaluation":"excluded","kind":"unsupported","maviClass":null,"nativeClass":"bicycle","reason":"Not one of the four MAVI motor-vehicle classes (harness plan section 12).","unsupportedKind":"outside-capability"},{"evaluation":"scored","kind":"exact","maviClass":"bus","nativeClass":"bus","reason":"Same practical meaning: passenger buses and coaches. Caveat: the minibus boundary is not documented by BDD100K."},{"evaluation":"scored","kind":"exact","maviClass":"car","nativeClass":"car","reason":"Same practical meaning: passenger cars. Caveat: BDD100K does not document how vans labelled 'car' are split; the MAVI guide (s3-2-labeling-guide.md) puts windowless cargo vans in truck."},{"evaluation":"excluded","kind":"unsupported","maviClass":null,"nativeClass":"caravan","reason":"Mixes towed caravans and motorhomes; no single MAVI class fits (taxonomy review: stays unresolved).","unsupportedKind":"vehicle-unresolved"},{"evaluation":"scored","kind":"exact","maviClass":"motorcycle","nativeClass":"motorcycle","reason":"Same practical meaning: motorised two-wheelers ridden seated. Caveat: scooter and moped inclusion is not stated in the repository documentation; the official config folds raw 'motor' into it."},{"evaluation":"excluded","kind":"unsupported","maviClass":null,"nativeClass":"other-person","reason":"A person, not a Vehicle.","unsupportedKind":"outside-capability"},{"evaluation":"excluded","kind":"unsupported","maviClass":null,"nativeClass":"other-vehicle","reason":"A vehicle whose type the dataset does not resolve into one of the four MAVI classes.","unsupportedKind":"vehicle-unresolved"},{"evaluation":"excluded","kind":"unsupported","maviClass":null,"nativeClass":"pedestrian","reason":"A person, not a Vehicle.","unsupportedKind":"outside-capability"},{"evaluation":"excluded","kind":"unsupported","maviClass":null,"nativeClass":"rider","reason":"The person on a two-wheeler, not the vehicle.","unsupportedKind":"outside-capability"},{"evaluation":"excluded","kind":"unsupported","maviClass":null,"nativeClass":"trailer","reason":"No trailer class in mavi-vehicle-subclass-v1, which labels a trailer-only Track unknown; the native class is preserved because trailer is the leading candidate for the next taxonomy version (taxonomy review).","unsupportedKind":"vehicle-unresolved"},{"evaluation":"excluded","kind":"unsupported","maviClass":null,"nativeClass":"train","reason":"Rail vehicle, outside the four MAVI road-vehicle classes (harness plan section 12).","unsupportedKind":"outside-capability"},{"evaluation":"scored","kind":"exact","maviClass":"truck","nativeClass":"truck","reason":"Same practical meaning: goods and work vehicles. Caveat: pickup and cargo-van handling is not stated in the repository documentation."},{"evaluation":"excluded","kind":"unsupported","maviClass":null,"nativeClass":"van","reason":"v1 splits vans by body into car or truck and the native label does not; the native class is preserved because van is a candidate class for a later taxonomy version (taxonomy review).","unsupportedKind":"vehicle-unresolved"}],"release":"MOT 2020 (box_track_20)","schemaVersion":"benchmark-class-mapping-v1"}