{"capability":"mavi-vehicle-subclass-v1","datasetId":"bdd100k-mot-2020-cocofmt","mappings":[{"evaluation":"excluded","kind":"unsupported","maviClass":null,"nativeClass":"bicycle","reason":"Not one of the four MAVI motor-vehicle classes.","unsupportedKind":"outside-capability"},{"evaluation":"scored","kind":"exact","maviClass":"bus","nativeClass":"bus","reason":"Same practical meaning: passenger buses and coaches."},{"evaluation":"scored","kind":"exact","maviClass":"car","nativeClass":"car","reason":"Same practical meaning: passenger cars. The generic BDD box_track conversion maps 'van' and 'caravan' to 'car' if such aliases are present; the published MOT 2020 taxonomy does not list them as native MOT classes. Caveat: BDD100K does not define every body-style boundary (the MAVI guide puts windowless cargo vans in truck)."},{"evaluation":"scored","kind":"exact","maviClass":"motorcycle","nativeClass":"motorcycle","reason":"Same practical meaning: motorised two-wheelers ridden seated."},{"evaluation":"excluded","kind":"unsupported","maviClass":null,"nativeClass":"pedestrian","reason":"A person, not a Vehicle.","unsupportedKind":"outside-capability"},{"evaluation":"excluded","kind":"unsupported","maviClass":null,"nativeClass":"rider","reason":"The person on a two-wheeler, not the vehicle.","unsupportedKind":"outside-capability"},{"evaluation":"excluded","kind":"unsupported","maviClass":null,"nativeClass":"train","reason":"Rail vehicle, outside the four MAVI road-vehicle classes.","unsupportedKind":"outside-capability"},{"evaluation":"scored","kind":"exact","maviClass":"truck","nativeClass":"truck","reason":"Same practical meaning: goods and work vehicles. Former 'trailer' distractors appear only as crowd (ignored), never as scored truck GT."}],"release":"MOT 2020 val (box_track_20) via MASA COCO-format derivative sha256:074ff795","schemaVersion":"benchmark-class-mapping-v1"}